{
  "$schema": "https://apps.humation.app/schema/app.schema.json",
  "name": "とんとん (Tonton)",
  "tagline": "Log what each of you paid and always know who owes whom",
  "description": "Tonton is a shared expense tracker for couples living together in Japan. Each person logs what they paid, picks a category and adjusts the split, and the home screen keeps one number in view: who owes whom, and how much. Settle up whenever you like and the balance resets to zero.\n\nRecurring costs such as rent and utilities post themselves each month, receipts are read on the device with the camera, and a monthly report turns the breakdown into a square card you can share. A pair links by invite code, and both phones stay in sync.\n\nBoth partners are hand-drawn Humation avatars. Each person builds their own in the icon editor, choosing hair, skin, outfit and accessory parts and a color for each; the app stores the part IDs and hex colors and composes the avatar on the device from the humation-1 asset set. The avatars mark who paid on every row of the history, stand on either side of the split card when you add an expense, appear on the home balance card and in the settings, and head the monthly share image.",
  "url": "https://tontonjp.com",
  "category": "lifestyle",
  "platforms": ["ios"],
  "pricing": "freemium",
  "humation": {
    "packages": ["@humation/assets-humation-1"],
    "usage": "Both partners' icons: every history row, the split card when adding an expense, the home balance card, the settings profiles and the monthly share image"
  },
  "developer": {
    "name": "koachan",
    "github": "koachan-dev",
    "url": "https://www.koachan.dev/"
  },
  "icon": "icon.png",
  "screenshots": [
    { "file": "screenshots/01-avatar-builder.png", "alt": "The icon editor with hair colors, skin tones and hairstyle options below a live preview of the hand-drawn avatar" },
    { "file": "screenshots/02-add-expense.png", "alt": "Adding an expense: both partners' avatars mark who paid, and the split card shows what each one owes" },
    { "file": "screenshots/03-home.png", "alt": "The home screen with a settle-up card showing both avatars and the amount one partner owes the other" },
    { "file": "screenshots/04-history.png", "alt": "The history list, where a small avatar beside every expense shows which partner paid for it" },
    { "file": "screenshots/05-share-card.png", "alt": "The monthly share card with both avatars, a category donut chart and the totals for the month" }
  ],
  "links": {
    "appStore": "https://apps.apple.com/jp/app/id6760719046",
    "x": "https://x.com/koachandev"
  },
  "addedAt": "2026-09-05"
}
